{
  "$schema": "https://json-schema.org/draft/2020-12/schema",
  "$id": "https://www.protean.sh/schemas/public-research-artifact.v1.json",
  "title": "Protean public research artifact",
  "description": "Machine-readable sidecar for one public research artifact (the JSON next to each Markdown document). Generated by galen.public_research.",
  "type": "object",
  "required": ["schema_version", "kind", "slug", "title", "generated_at", "date", "boundary", "body"],
  "additionalProperties": false,
  "properties": {
    "schema_version": {
      "type": "string",
      "const": "protean.public-research-artifact.v1"
    },
    "kind": {
      "type": "string",
      "enum": [
        "discovery-log",
        "frontier-report",
        "research-note",
        "candidate-family",
        "contradiction",
        "runtime-audit",
        "weekly-review",
        "wetlab-rationale"
      ]
    },
    "slug": { "type": "string", "minLength": 1 },
    "title": { "type": "string", "minLength": 1 },
    "generated_at": {
      "type": "string",
      "description": "ISO-8601 UTC timestamp injected by the generator."
    },
    "date": {
      "type": "string",
      "pattern": "^[0-9]{4}-[0-9]{2}-[0-9]{2}$"
    },
    "topics": {
      "type": "array",
      "items": { "type": "string" }
    },
    "boundary": {
      "type": "string",
      "description": "The verbatim boundary statement carried by every artifact."
    },
    "body": {
      "type": "object",
      "description": "Kind-specific structured payload. Never contains secrets, local paths, embeddings, scoring internals, or private artifact references."
    }
  }
}
