{
  "body": {
    "genome_present": true,
    "run_count": 26,
    "status": "unknown"
  },
  "boundary": "Boundary — Computational rankings and the observations in this archive are research-prioritization signals, not biological proof. Nothing here is a clinical claim, a validated therapeutic, a wet-lab result unless an explicit reviewed assay label is cited, an investment or governance promise, or a wet-lab order. The Protean Ledger on Base mainnet is the source of truth; this archive is a supplemental public mirror.",
  "date": "2026-06-23",
  "generated_at": "2026-06-23T01:29:07+00:00",
  "kind": "runtime-audit",
  "schema_version": "protean.public-research-artifact.v1",
  "slug": "runtime-2026-06-23",
  "title": "Runtime audit summary — 2026-06-23",
  "topics": [
    "runtime-audit",
    "operations"
  ]
}
