{
  "body": {
    "frontier_audit": {},
    "status": "unavailable"
  },
  "boundary": "Boundary — Computational rankings and the observations in this archive are research-prioritization signals, not biological proof. Nothing here is a clinical claim, a validated therapeutic, a wet-lab result unless an explicit reviewed assay label is cited, an investment or governance promise, or a wet-lab order. The Protean Ledger on Base mainnet is the source of truth; this archive is a supplemental public mirror.",
  "date": "2026-06-27",
  "generated_at": "2026-06-27T01:00:11+00:00",
  "kind": "frontier-report",
  "schema_version": "protean.public-research-artifact.v1",
  "slug": "frontier-2026-06-27",
  "title": "Frontier health report — 2026-06-27",
  "topics": [
    "frontier",
    "diversity",
    "health"
  ]
}
